{
  "$schema": "http://json-schema.org/draft-07/schema#",
  "$id": "https://github.com/ERC20s/world-peace/data/organisation.schema.json",
  "title": "Organisation",
  "description": "A peace-building organisation referenced from one or more conflict pages. Real entries live in data/organisations/<id>.json. Shared field formats are in defs.schema.json.",
  "type": "object",
  "additionalProperties": false,
  "required": ["id", "name", "website", "country", "mission"],
  "properties": {
    "id": {
      "type": "string",
      "description": "URL-safe identifier used to link from conflict pages, e.g. \"corrymeela-community\".",
      "pattern": "^[a-z0-9]+(-[a-z0-9]+)*$"
    },
    "name": {
      "type": "string",
      "minLength": 1
    },
    "website": {
      "$ref": "defs.schema.json#/definitions/httpUrl"
    },
    "country": {
      "$ref": "defs.schema.json#/definitions/countryCode",
      "description": "ISO 3166-1 alpha-2 code of the primary country the organisation operates in."
    },
    "mission": {
      "type": "string",
      "description": "Short, neutral description of the organisation's mission.",
      "minLength": 1
    },
    "contact": {
      "description": "Public-facing contact channel (contact page URL or mailto: address), not a fundraising link.",
      "anyOf": [
        { "$ref": "defs.schema.json#/definitions/httpUrl" },
        { "type": "string", "pattern": "^mailto:[^@\\s]+@[^@\\s]+\\.[^@\\s]+$" }
      ]
    },
    "linkedInitiatives": {
      "type": "array",
      "description": "Names of initiatives (from conflict pages) this organisation runs.",
      "items": { "type": "string", "minLength": 1 }
    },
    "sourcesCheckedOn": {
      "$ref": "defs.schema.json#/definitions/isoDate",
      "description": "ISO date when the organisation page's external links were last validated."
    }
  }
}
